{
  "$schema": "../../recipe.schema.json",
  "name": "Media format test: MP4",
  "author": "sick development tools",
  "id": "c72d8a10-4e06-4a38-9b20-000000000010",
  "date": "22.08.2026",
  "difficulty": 1,
  "language": "ru",
  "tags": ["media-format", "video", "mp4"],
  "rounds": [{
    "name": "MP4",
    "themes": [{
      "name": "Проверка MP4",
      "questions": [{
        "price": 100,
        "content": [{
          "type": "video",
          "file": "video/mp4/siq-test-pattern.mp4",
          "waitForFinish": true
        }],
        "answerContent": [{ "type": "text", "text": "MP4 завершён" }],
        "right": ["MP4 воспроизводится"]
      }]
    }]
  }]
}
