{
  "$schema": "../../recipe.schema.json",
  "name": "Media format test: JPEG",
  "author": "sick development tools",
  "id": "c72d8a10-4e06-4a38-9b20-000000000003",
  "date": "22.08.2026",
  "difficulty": 1,
  "language": "ru",
  "tags": ["media-format", "image", "jpeg"],
  "rounds": [{
    "name": "JPEG",
    "themes": [{
      "name": "Проверка JPEG",
      "questions": [{
        "price": 100,
        "content": [
          { "type": "text", "text": "Должно отобразиться тестовое изображение JPEG 640×360." },
          { "type": "image", "file": "images/jpeg/siq-test.jpeg" }
        ],
        "right": ["JPEG отображается"]
      }]
    }]
  }]
}
