{
  "$schema": "../../recipe.schema.json",
  "name": "Media format test: JPE",
  "author": "sick development tools",
  "id": "c72d8a10-4e06-4a38-9b20-000000000002",
  "date": "22.08.2026",
  "difficulty": 1,
  "language": "ru",
  "tags": ["media-format", "image", "jpe"],
  "rounds": [{
    "name": "JPE",
    "themes": [{
      "name": "Проверка JPE",
      "questions": [{
        "price": 100,
        "content": [
          { "type": "text", "text": "Должно отобразиться тестовое изображение JPE 640×360." },
          { "type": "image", "file": "images/jpe/siq-test.jpe" }
        ],
        "right": ["JPE отображается"]
      }]
    }]
  }]
}
